{
  "incident_id": "inc-20260225-001",
  "title": "Database connection pool exhaustion causing API latency and web app degradation",
  "severity": "critical",
  "status": "investigating",
  "signals": ["sig-001", "sig-002", "sig-003"],
  "affected_entities": [
    "ent:vm:postgres-host",
    "ent:database:postgres-primary",
    "ent:service:api-service",
    "ent:application:web-app"
  ],
  "root_cause_candidates": [],
  "created_at": "2026-02-25T11:35:00Z",
  "updated_at": "2026-02-25T11:40:00Z",
  "owner": "platform-oncall",
  "external_refs": []
}
